{
  "formatVersion": "decision-tree-bundle.v1",
  "bundleId": "vsh-vnha-2022-image-targets",
  "bundleVersion": "0.3.0",
  "locale": "vi-VN",
  "clinicalStatus": "under_review",
  "clinicalReviewRequired": true,
  "sourceDocuments": [
    {
      "id": "image_01_bp_diagnosis",
      "title": "Sơ đồ chẩn đoán tăng huyết áp",
      "version": "image-reference",
      "localFile": "decision_trees/images/01_bp_diagnosis.png"
    },
    {
      "id": "image_02_bp_thresholds_targets",
      "title": "Ngưỡng huyết áp ban đầu và đích điều trị",
      "version": "image-reference",
      "localFile": "decision_trees/images/02_bp_thresholds_and_targets.png"
    },
    {
      "id": "image_03_optimized_treatment",
      "title": "Sơ đồ điều trị tăng huyết áp tối ưu",
      "version": "image-reference",
      "localFile": "decision_trees/images/03_optimized_hypertension_treatment.png"
    },
    {
      "id": "image_04_risk_stratification",
      "title": "Bảng phân tầng nguy cơ trong tăng huyết áp",
      "version": "image-reference",
      "localFile": "decision_trees/images/04_hypertension_risk_stratification.png"
    },
    {
      "id": "image_05_uncontrolled_resistant",
      "title": "Phân loại tăng huyết áp không kiểm soát/kháng trị",
      "version": "image-reference",
      "localFile": "decision_trees/images/05_uncontrolled_resistant_hypertension.png"
    }
  ],
  "variables": [
    {
      "id": "bp.measurementMethod",
      "label": "Phương pháp đo HA xác nhận",
      "dataType": "enum",
      "unit": null,
      "requiredForEvaluation": true,
      "definition": "Phương pháp dùng sau nhánh đo phòng khám lần 1/lần 2.",
      "sourceSystem": "vitals",
      "sourceRefs": [
        {
          "sourceId": "image_01_bp_diagnosis",
          "page": 1,
          "section": "Sơ đồ chẩn đoán tăng huyết áp",
          "tableOrFigure": "01_bp_diagnosis.png",
          "note": "Phương pháp dùng sau nhánh đo phòng khám lần 1/lần 2."
        }
      ],
      "allowedValues": [
        "office_3rd",
        "home",
        "abpm_24h"
      ]
    },
    {
      "id": "bp.office1.systolicMmHg",
      "label": "HA phòng khám lần 1 - HATT",
      "dataType": "number",
      "unit": "mmHg",
      "requiredForEvaluation": false,
      "definition": "Giá trị HATT của lần đo phòng khám tương ứng.",
      "sourceSystem": "vitals",
      "sourceRefs": [
        {
          "sourceId": "image_01_bp_diagnosis",
          "page": 1,
          "section": "Sơ đồ chẩn đoán tăng huyết áp",
          "tableOrFigure": "01_bp_diagnosis.png",
          "note": "Giá trị HATT của lần đo phòng khám tương ứng."
        }
      ],
      "validation": {
        "minimum": 40,
        "maximum": 300
      }
    },
    {
      "id": "bp.office1.diastolicMmHg",
      "label": "HA phòng khám lần 1 - HATTr",
      "dataType": "number",
      "unit": "mmHg",
      "requiredForEvaluation": false,
      "definition": "Giá trị HATTr của lần đo phòng khám tương ứng.",
      "sourceSystem": "vitals",
      "sourceRefs": [
        {
          "sourceId": "image_01_bp_diagnosis",
          "page": 1,
          "section": "Sơ đồ chẩn đoán tăng huyết áp",
          "tableOrFigure": "01_bp_diagnosis.png",
          "note": "Giá trị HATTr của lần đo phòng khám tương ứng."
        }
      ],
      "validation": {
        "minimum": 20,
        "maximum": 200
      }
    },
    {
      "id": "bp.office2.systolicMmHg",
      "label": "HA phòng khám lần 2 - HATT",
      "dataType": "number",
      "unit": "mmHg",
      "requiredForEvaluation": false,
      "definition": "Giá trị HATT của lần đo phòng khám tương ứng.",
      "sourceSystem": "vitals",
      "sourceRefs": [
        {
          "sourceId": "image_01_bp_diagnosis",
          "page": 1,
          "section": "Sơ đồ chẩn đoán tăng huyết áp",
          "tableOrFigure": "01_bp_diagnosis.png",
          "note": "Giá trị HATT của lần đo phòng khám tương ứng."
        }
      ],
      "validation": {
        "minimum": 40,
        "maximum": 300
      }
    },
    {
      "id": "bp.office2.diastolicMmHg",
      "label": "HA phòng khám lần 2 - HATTr",
      "dataType": "number",
      "unit": "mmHg",
      "requiredForEvaluation": false,
      "definition": "Giá trị HATTr của lần đo phòng khám tương ứng.",
      "sourceSystem": "vitals",
      "sourceRefs": [
        {
          "sourceId": "image_01_bp_diagnosis",
          "page": 1,
          "section": "Sơ đồ chẩn đoán tăng huyết áp",
          "tableOrFigure": "01_bp_diagnosis.png",
          "note": "Giá trị HATTr của lần đo phòng khám tương ứng."
        }
      ],
      "validation": {
        "minimum": 20,
        "maximum": 200
      }
    },
    {
      "id": "bp.office3.systolicMmHg",
      "label": "HA phòng khám lần 3 - HATT",
      "dataType": "number",
      "unit": "mmHg",
      "requiredForEvaluation": false,
      "definition": "Giá trị HATT của lần đo phòng khám tương ứng.",
      "sourceSystem": "vitals",
      "sourceRefs": [
        {
          "sourceId": "image_01_bp_diagnosis",
          "page": 1,
          "section": "Sơ đồ chẩn đoán tăng huyết áp",
          "tableOrFigure": "01_bp_diagnosis.png",
          "note": "Giá trị HATT của lần đo phòng khám tương ứng."
        }
      ],
      "validation": {
        "minimum": 40,
        "maximum": 300
      }
    },
    {
      "id": "bp.office3.diastolicMmHg",
      "label": "HA phòng khám lần 3 - HATTr",
      "dataType": "number",
      "unit": "mmHg",
      "requiredForEvaluation": false,
      "definition": "Giá trị HATTr của lần đo phòng khám tương ứng.",
      "sourceSystem": "vitals",
      "sourceRefs": [
        {
          "sourceId": "image_01_bp_diagnosis",
          "page": 1,
          "section": "Sơ đồ chẩn đoán tăng huyết áp",
          "tableOrFigure": "01_bp_diagnosis.png",
          "note": "Giá trị HATTr của lần đo phòng khám tương ứng."
        }
      ],
      "validation": {
        "minimum": 20,
        "maximum": 200
      }
    },
    {
      "id": "bp.office1.targetOrganDamageOrCvd",
      "label": "Bằng chứng tổn thương cơ quan đích/bệnh tim mạch ở lần 1",
      "dataType": "boolean",
      "unit": null,
      "requiredForEvaluation": false,
      "definition": "Có bằng chứng tổn thương cơ quan đích hoặc bệnh tim mạch trong đánh giá ban đầu.",
      "sourceSystem": "clinician_input",
      "sourceRefs": [
        {
          "sourceId": "image_01_bp_diagnosis",
          "page": 1,
          "section": "Sơ đồ chẩn đoán tăng huyết áp",
          "tableOrFigure": "01_bp_diagnosis.png",
          "note": "Có bằng chứng tổn thương cơ quan đích hoặc bệnh tim mạch trong đánh giá ban đầu."
        }
      ]
    },
    {
      "id": "bp.office2.targetOrganDamageOrCvd",
      "label": "Bằng chứng tổn thương cơ quan đích/bệnh tim mạch ở lần 2",
      "dataType": "boolean",
      "unit": null,
      "requiredForEvaluation": false,
      "definition": "Có bằng chứng tổn thương cơ quan đích do tăng huyết áp hoặc bệnh tim mạch ở lần 2.",
      "sourceSystem": "clinician_input",
      "sourceRefs": [
        {
          "sourceId": "image_01_bp_diagnosis",
          "page": 1,
          "section": "Sơ đồ chẩn đoán tăng huyết áp",
          "tableOrFigure": "01_bp_diagnosis.png",
          "note": "Có bằng chứng tổn thương cơ quan đích do tăng huyết áp hoặc bệnh tim mạch ở lần 2."
        }
      ]
    },
    {
      "id": "bp.home.systolicMmHg",
      "label": "HA tại nhà - HATT",
      "dataType": "number",
      "unit": "mmHg",
      "requiredForEvaluation": false,
      "definition": "Giá trị HATT của phương pháp đo ngoài phòng khám.",
      "sourceSystem": "vitals",
      "sourceRefs": [
        {
          "sourceId": "image_01_bp_diagnosis",
          "page": 1,
          "section": "Sơ đồ chẩn đoán tăng huyết áp",
          "tableOrFigure": "01_bp_diagnosis.png",
          "note": "Giá trị HATT của phương pháp đo ngoài phòng khám."
        }
      ],
      "validation": {
        "minimum": 40,
        "maximum": 300
      }
    },
    {
      "id": "bp.home.diastolicMmHg",
      "label": "HA tại nhà - HATTr",
      "dataType": "number",
      "unit": "mmHg",
      "requiredForEvaluation": false,
      "definition": "Giá trị HATTr của phương pháp đo ngoài phòng khám.",
      "sourceSystem": "vitals",
      "sourceRefs": [
        {
          "sourceId": "image_01_bp_diagnosis",
          "page": 1,
          "section": "Sơ đồ chẩn đoán tăng huyết áp",
          "tableOrFigure": "01_bp_diagnosis.png",
          "note": "Giá trị HATTr của phương pháp đo ngoài phòng khám."
        }
      ],
      "validation": {
        "minimum": 20,
        "maximum": 200
      }
    },
    {
      "id": "bp.abpm.daytime.systolicMmHg",
      "label": "HALT ban ngày - HATT",
      "dataType": "number",
      "unit": "mmHg",
      "requiredForEvaluation": false,
      "definition": "Giá trị HATT của phương pháp đo ngoài phòng khám.",
      "sourceSystem": "vitals",
      "sourceRefs": [
        {
          "sourceId": "image_01_bp_diagnosis",
          "page": 1,
          "section": "Sơ đồ chẩn đoán tăng huyết áp",
          "tableOrFigure": "01_bp_diagnosis.png",
          "note": "Giá trị HATT của phương pháp đo ngoài phòng khám."
        }
      ],
      "validation": {
        "minimum": 40,
        "maximum": 300
      }
    },
    {
      "id": "bp.abpm.daytime.diastolicMmHg",
      "label": "HALT ban ngày - HATTr",
      "dataType": "number",
      "unit": "mmHg",
      "requiredForEvaluation": false,
      "definition": "Giá trị HATTr của phương pháp đo ngoài phòng khám.",
      "sourceSystem": "vitals",
      "sourceRefs": [
        {
          "sourceId": "image_01_bp_diagnosis",
          "page": 1,
          "section": "Sơ đồ chẩn đoán tăng huyết áp",
          "tableOrFigure": "01_bp_diagnosis.png",
          "note": "Giá trị HATTr của phương pháp đo ngoài phòng khám."
        }
      ],
      "validation": {
        "minimum": 20,
        "maximum": 200
      }
    },